timestamp,question,answer,context_used,time,diff
"2026-01-21T00:52:40.442488","Do you know LifeForest?","No information about LifeForest is present in the provided context. The context appears to be related to stock market updates and promotions, but it does not mention LifeForest.","LifeForest: The Living Archive: LifeForest: The Living Archive\nIn a world increasingly dominated by digital clouds and cold storage, LifeForest oﬀers a radical, \nbiological alternative to memory preservation. Founded on the intersection of synthetic biology \nand forestry, LifeForest is a \"Living Data Bank\" that encodes human history, art, and personal \nlegacies into the DNA of ancient-growth tree species.\nThe Bio-Silicon Revolution\nThe company’s breakthrough lies in its DNA-Encapsulation Technology. Using CRISPR-based \nsequencing, LifeForest converts binary data—photos, videos, and text—into four-base genetic \ncode ($A, C, G, T$). This code is synthesized and integrated into the non-coding regions of a \nsapling’s genome, allowing the tree to act as a permanent, self-replicating hard drive that grows \nwith time.\nEcosystem Features:\nThe Eternal Grove: Customers can plant a \"Memory Tree\" in protected global sanctuaries. As the \ntree grows, the data remains protected within its cellular structure, shielded from electromagnetic \npulses or hardware failure.\nArbor-Retrieval Kits: Using a non-invasive leaf-sampling tool, future generations can sequence a \nsmall portion of the tree’s foliage to decode and view the stored \"ancestral\" data.\nSymbiotic Maintenance: The revenue from data storage is funneled directly into global \nreforestation eﬀorts, making LifeForest the world’s ﬁrst carbon-negative data center.\nLifeForest isn't just a storage solution; it is a bridge between the digital present and a sustainable, \nbiological future. It ensures that while technology may fade, our stories will continue to breathe.\n (2026-01-21T00:52:57.667516)\n---\nReal-time update for Microsoft (MSFT): Microsoft (MSFT) trading at $454.26, -1.24% change. (2026-01-21T01:26:12.105122)\n---\nReal-time update for Google Alphabet (GOOGL): Google Alphabet (GOOGL) trading at $322.95, -2.16% change. (2026-01-21T01:26:11.766809)\n---\nReal-time update for Apple (AAPL): Apple (AAPL) trading at $246.91, -3.28% change. (2026-01-21T01:26:11.441256)\n---\nIndustry Study: NFL Bettors Wagered Less Than Expected At Regulated Sportsbooks This Season: Optimove report found parlays remained popular, but live betting was not the boon operators anticipated (2026-01-21T01:21:25.234631)\n---\n2026-01-19 Emacs news: <ul>\n<li>Upcoming events (iCal file, Org):\n<ul>\n<li>M-x Research: TBA https://m-x-research.github.io/ Wed Jan 21 0800 America/Vancouver - 1000 America/Chicago - 1100 America/Toronto - 1600 Etc/GMT - 1700 Europe/Berlin - 2130 Asia/Kolkata – Thu Jan 22 0000 Asi… (2026-01-21T01:21:25.234056)\n---\nRockhampton residents prepare for flooding from ex-Cyclone Koji: Flooding on the Fitzroy River will be less severe than originally forecast, however about 280 properties could still be impacted. (2026-01-21T01:21:25.234824)",1768938971808,1
"2026-01-21T00:48:50.590115","Do you know HereOne?","Yes, I'm familiar with HereOne. It's a wearable technology device that combines audio and intelligence, introducing a concept called \"Layered Listening\" which allows users to interact with their environment in a new way. HereOne features a Real-Time Audio Filtering engine, enabling selective transparency of sound, and includes integrated features like Smart Transparency, Biometric Synchronization, and a Contextual AI Assistant.","HereOne: The Convergence of Audio and Intelligence: HereOne: The Convergence of Audio and Intelligence\nIn the rapidly evolving landscape of wearable technology, HereOne stands as the deﬁnitive bridge \nbetween the physical and digital auditory worlds. While predecessors focused merely on noise \ncancellation, HereOne introduces \"Layered Listening\"—a paradigm shift in how we interact with \nour environment.\nMastering the Soundscape\nThe core innovation of HereOne lies in its Real-Time Audio Filtering engine. Unlike standard \nheadphones that isolate the user, HereOne allows for the selective transparency of sound. \nThrough an intuitive mobile interface, users can \"EQ the world,\" muting the roar of a jet engine \nwhile crystalizing the voice of a person sitting directly across from them.\nIntegrated Features:\nSmart Transparency: Adaptive microphones identify speciﬁc acoustic signatures, automatically \nlowering the volume of disruptive city sirens while maintaining awareness of ambient traﬃc.\nBiometric Synchronization: Integrated sensors track heart rate and stress levels, subtly adjusting \nthe sound proﬁle—playing calming white noise or uplifting frequencies—to match the user's \nphysiological state.\nContextual AI Assistant: A localized processor handles voice commands oﬄine, providing instant \ntranslations or meeting summaries directly into the ear canal without needing a cloud connection.\nBy blending high-ﬁdelity acoustics with sophisticated environmental control, HereOne ensures \nthat users are never just listening—they are curating their reality.\n (2026-01-21T00:40:53.396065)\n---\nReal-time update for Microsoft (MSFT): Microsoft (MSFT) trading at $454.26, -1.24% change. (2026-01-21T01:26:12.105122)\n---\nReal-time update for Google Alphabet (GOOGL): Google Alphabet (GOOGL) trading at $322.95, -2.16% change. (2026-01-21T01:26:11.766809)\n---\nReal-time update for Apple (AAPL): Apple (AAPL) trading at $246.91, -3.28% change. (2026-01-21T01:26:11.441256)\n---\nIndustry Study: NFL Bettors Wagered Less Than Expected At Regulated Sportsbooks This Season: Optimove report found parlays remained popular, but live betting was not the boon operators anticipated (2026-01-21T01:21:25.234631)\n---\n2026-01-19 Emacs news: <ul>\n<li>Upcoming events (iCal file, Org):\n<ul>\n<li>M-x Research: TBA https://m-x-research.github.io/ Wed Jan 21 0800 America/Vancouver - 1000 America/Chicago - 1100 America/Toronto - 1600 Etc/GMT - 1700 Europe/Berlin - 2130 Asia/Kolkata – Thu Jan 22 0000 Asi… (2026-01-21T01:21:25.234056)\n---\nRockhampton residents prepare for flooding from ex-Cyclone Koji: Flooding on the Fitzroy River will be less severe than originally forecast, however about 280 properties could still be impacted. (2026-01-21T01:21:25.234824)",1768938971808,1
"2026-01-21T01:14:37.199587","Do you know MetaMaterial?","I'm not aware of any information about MetaMaterial in the provided context, it seems to be about various news updates including India's new mineral law, smartphone updates, flooding, and real-time stock updates for companies like Intel, AMD, Netflix, and Meta Facebook.","MetaMaterial: Engineering the Impossible: MetaMaterial: Engineering the Impossible\nMetaMaterial is a pioneering deep-tech venture dedicated to the commercialization of \"intelligent \nmatter.\" Moving beyond the limitations of the periodic table, the company designs synthetic \nstructures that exhibit physical properties not found in nature—such as negative refractive \nindices, perfect acoustic absorption, and programmable stiﬀness.\nBeyond Atomic Limits\nThe core of MetaMaterial’s innovation is the Sub-Wavelength Architecture. Rather than changing \nthe chemical composition of a substance, the company uses high-precision 3D nano-lithography \nto arrange standard polymers and metals into intricate geometric patterns. These patterns interact \nwith waves—light, sound, and radio—at a scale smaller than their wavelength, allowing for \nunprecedented control over energy.\nBreakthrough Applications:\nThe Invisibility Cloak: By bending electromagnetic waves around an object rather than reﬂecting \nthem, MetaMaterial has developed ultra-thin \"cloaking\" ﬁlms for aerospace, making vehicles \ninvisible to speciﬁc radar frequencies.\nAcoustic Insulation: Their \"Silent-Tile\" technology can block 99% of low-frequency industrial \nnoise using a panel only millimeters thick, a feat impossible for traditional foam or lead.\nSuper-Lensing: MetaMaterial optics can bypass the \"diﬀraction limit\" of standard glass, allowing \nmicroscopes to see individual DNA strands using visible light—a revolution for point-of-care \ndiagnostics.\nMetaMaterial is shifting the paradigm from \"ﬁnding\" materials to \"designing\" them. By treating \nphysics as a programmable interface, the company is building the foundations for a world where \nthe physical environment adapts perfectly to human needs.\n (2026-01-21T01:14:55.235951)\n---\nReal-time update for Microsoft (MSFT): Microsoft (MSFT) trading at $454.26, -1.24% change. (2026-01-21T01:26:12.105122)\n---\nReal-time update for Google Alphabet (GOOGL): Google Alphabet (GOOGL) trading at $322.95, -2.16% change. (2026-01-21T01:26:11.766809)\n---\nReal-time update for Apple (AAPL): Apple (AAPL) trading at $246.91, -3.28% change. (2026-01-21T01:26:11.441256)\n---\nIndustry Study: NFL Bettors Wagered Less Than Expected At Regulated Sportsbooks This Season: Optimove report found parlays remained popular, but live betting was not the boon operators anticipated (2026-01-21T01:21:25.234631)\n---\n2026-01-19 Emacs news: <ul>\n<li>Upcoming events (iCal file, Org):\n<ul>\n<li>M-x Research: TBA https://m-x-research.github.io/ Wed Jan 21 0800 America/Vancouver - 1000 America/Chicago - 1100 America/Toronto - 1600 Etc/GMT - 1700 Europe/Berlin - 2130 Asia/Kolkata – Thu Jan 22 0000 Asi… (2026-01-21T01:21:25.234056)\n---\nRockhampton residents prepare for flooding from ex-Cyclone Koji: Flooding on the Fitzroy River will be less severe than originally forecast, however about 280 properties could still be impacted. (2026-01-21T01:21:25.234824)",1768938971808,1
"2026-01-21T01:15:14.145118","Do you know MetaMaterial?","Yes, I'm familiar with MetaMaterial. It's a deep-tech venture that designs and commercializes synthetic structures, often referred to as \"intelligent matter,\" which exhibit physical properties not found in nature. They use high-precision 3D nano-lithography to arrange standard polymers and metals into intricate geometric patterns, allowing for unprecedented control over energy. This technology has led to breakthrough applications such as invisibility cloaks, acoustic insulation, and super-lensing, which have the potential to revolutionize various industries.","MetaMaterial: Engineering the Impossible: MetaMaterial: Engineering the Impossible\nMetaMaterial is a pioneering deep-tech venture dedicated to the commercialization of \"intelligent \nmatter.\" Moving beyond the limitations of the periodic table, the company designs synthetic \nstructures that exhibit physical properties not found in nature—such as negative refractive \nindices, perfect acoustic absorption, and programmable stiﬀness.\nBeyond Atomic Limits\nThe core of MetaMaterial’s innovation is the Sub-Wavelength Architecture. Rather than changing \nthe chemical composition of a substance, the company uses high-precision 3D nano-lithography \nto arrange standard polymers and metals into intricate geometric patterns. These patterns interact \nwith waves—light, sound, and radio—at a scale smaller than their wavelength, allowing for \nunprecedented control over energy.\nBreakthrough Applications:\nThe Invisibility Cloak: By bending electromagnetic waves around an object rather than reﬂecting \nthem, MetaMaterial has developed ultra-thin \"cloaking\" ﬁlms for aerospace, making vehicles \ninvisible to speciﬁc radar frequencies.\nAcoustic Insulation: Their \"Silent-Tile\" technology can block 99% of low-frequency industrial \nnoise using a panel only millimeters thick, a feat impossible for traditional foam or lead.\nSuper-Lensing: MetaMaterial optics can bypass the \"diﬀraction limit\" of standard glass, allowing \nmicroscopes to see individual DNA strands using visible light—a revolution for point-of-care \ndiagnostics.\nMetaMaterial is shifting the paradigm from \"ﬁnding\" materials to \"designing\" them. By treating \nphysics as a programmable interface, the company is building the foundations for a world where \nthe physical environment adapts perfectly to human needs.\n (2026-01-21T01:14:55.235951)\n---\nReal-time update for Microsoft (MSFT): Microsoft (MSFT) trading at $454.26, -1.24% change. (2026-01-21T01:26:12.105122)\n---\nReal-time update for Google Alphabet (GOOGL): Google Alphabet (GOOGL) trading at $322.95, -2.16% change. (2026-01-21T01:26:11.766809)\n---\nReal-time update for Apple (AAPL): Apple (AAPL) trading at $246.91, -3.28% change. (2026-01-21T01:26:11.441256)\n---\nIndustry Study: NFL Bettors Wagered Less Than Expected At Regulated Sportsbooks This Season: Optimove report found parlays remained popular, but live betting was not the boon operators anticipated (2026-01-21T01:21:25.234631)\n---\n2026-01-19 Emacs news: <ul>\n<li>Upcoming events (iCal file, Org):\n<ul>\n<li>M-x Research: TBA https://m-x-research.github.io/ Wed Jan 21 0800 America/Vancouver - 1000 America/Chicago - 1100 America/Toronto - 1600 Etc/GMT - 1700 Europe/Berlin - 2130 Asia/Kolkata – Thu Jan 22 0000 Asi… (2026-01-21T01:21:25.234056)\n---\nRockhampton residents prepare for flooding from ex-Cyclone Koji: Flooding on the Fitzroy River will be less severe than originally forecast, however about 280 properties could still be impacted. (2026-01-21T01:21:25.234824)",1768938971808,1
"2026-01-21T01:14:37.199587","Do you know MetaMaterial?","I'm not aware of any information about MetaMaterial in the provided context, it seems to be about various news updates including India's new mineral law, smartphone updates, flooding, and real-time stock updates for companies like Intel, AMD, Netflix, and Meta Facebook.","MetaMaterial: Engineering the Impossible: MetaMaterial: Engineering the Impossible\nMetaMaterial is a pioneering deep-tech venture dedicated to the commercialization of \"intelligent \nmatter.\" Moving beyond the limitations of the periodic table, the company designs synthetic \nstructures that exhibit physical properties not found in nature—such as negative refractive \nindices, perfect acoustic absorption, and programmable stiﬀness.\nBeyond Atomic Limits\nThe core of MetaMaterial’s innovation is the Sub-Wavelength Architecture. Rather than changing \nthe chemical composition of a substance, the company uses high-precision 3D nano-lithography \nto arrange standard polymers and metals into intricate geometric patterns. These patterns interact \nwith waves—light, sound, and radio—at a scale smaller than their wavelength, allowing for \nunprecedented control over energy.\nBreakthrough Applications:\nThe Invisibility Cloak: By bending electromagnetic waves around an object rather than reﬂecting \nthem, MetaMaterial has developed ultra-thin \"cloaking\" ﬁlms for aerospace, making vehicles \ninvisible to speciﬁc radar frequencies.\nAcoustic Insulation: Their \"Silent-Tile\" technology can block 99% of low-frequency industrial \nnoise using a panel only millimeters thick, a feat impossible for traditional foam or lead.\nSuper-Lensing: MetaMaterial optics can bypass the \"diﬀraction limit\" of standard glass, allowing \nmicroscopes to see individual DNA strands using visible light—a revolution for point-of-care \ndiagnostics.\nMetaMaterial is shifting the paradigm from \"ﬁnding\" materials to \"designing\" them. By treating \nphysics as a programmable interface, the company is building the foundations for a world where \nthe physical environment adapts perfectly to human needs.\n (2026-01-21T01:14:55.235951)\n---\nReal-time update for Microsoft (MSFT): Microsoft (MSFT) trading at $454.26, -1.24% change. (2026-01-21T01:26:12.105122)\n---\nReal-time update for Google Alphabet (GOOGL): Google Alphabet (GOOGL) trading at $322.95, -2.16% change. (2026-01-21T01:26:11.766809)\n---\nReal-time update for Apple (AAPL): Apple (AAPL) trading at $246.91, -3.28% change. (2026-01-21T01:26:11.441256)\n---\nIndustry Study: NFL Bettors Wagered Less Than Expected At Regulated Sportsbooks This Season: Optimove report found parlays remained popular, but live betting was not the boon operators anticipated (2026-01-21T01:21:25.234631)\n---\n2026-01-19 Emacs news: <ul>\n<li>Upcoming events (iCal file, Org):\n<ul>\n<li>M-x Research: TBA https://m-x-research.github.io/ Wed Jan 21 0800 America/Vancouver - 1000 America/Chicago - 1100 America/Toronto - 1600 Etc/GMT - 1700 Europe/Berlin - 2130 Asia/Kolkata – Thu Jan 22 0000 Asi… (2026-01-21T01:21:25.234056)\n---\nRockhampton residents prepare for flooding from ex-Cyclone Koji: Flooding on the Fitzroy River will be less severe than originally forecast, however about 280 properties could still be impacted. (2026-01-21T01:21:25.234824)",1768938973276,-1
"2026-01-21T01:15:14.145118","Do you know MetaMaterial?","Yes, I'm familiar with MetaMaterial. It's a deep-tech venture that designs and commercializes synthetic structures, often referred to as \"intelligent matter,\" which exhibit physical properties not found in nature. They use high-precision 3D nano-lithography to arrange standard polymers and metals into intricate geometric patterns, allowing for unprecedented control over energy. This technology has led to breakthrough applications such as invisibility cloaks, acoustic insulation, and super-lensing, which have the potential to revolutionize various industries.","MetaMaterial: Engineering the Impossible: MetaMaterial: Engineering the Impossible\nMetaMaterial is a pioneering deep-tech venture dedicated to the commercialization of \"intelligent \nmatter.\" Moving beyond the limitations of the periodic table, the company designs synthetic \nstructures that exhibit physical properties not found in nature—such as negative refractive \nindices, perfect acoustic absorption, and programmable stiﬀness.\nBeyond Atomic Limits\nThe core of MetaMaterial’s innovation is the Sub-Wavelength Architecture. Rather than changing \nthe chemical composition of a substance, the company uses high-precision 3D nano-lithography \nto arrange standard polymers and metals into intricate geometric patterns. These patterns interact \nwith waves—light, sound, and radio—at a scale smaller than their wavelength, allowing for \nunprecedented control over energy.\nBreakthrough Applications:\nThe Invisibility Cloak: By bending electromagnetic waves around an object rather than reﬂecting \nthem, MetaMaterial has developed ultra-thin \"cloaking\" ﬁlms for aerospace, making vehicles \ninvisible to speciﬁc radar frequencies.\nAcoustic Insulation: Their \"Silent-Tile\" technology can block 99% of low-frequency industrial \nnoise using a panel only millimeters thick, a feat impossible for traditional foam or lead.\nSuper-Lensing: MetaMaterial optics can bypass the \"diﬀraction limit\" of standard glass, allowing \nmicroscopes to see individual DNA strands using visible light—a revolution for point-of-care \ndiagnostics.\nMetaMaterial is shifting the paradigm from \"ﬁnding\" materials to \"designing\" them. By treating \nphysics as a programmable interface, the company is building the foundations for a world where \nthe physical environment adapts perfectly to human needs.\n (2026-01-21T01:14:55.235951)\n---\nReal-time update for Microsoft (MSFT): Microsoft (MSFT) trading at $454.26, -1.24% change. (2026-01-21T01:26:12.105122)\n---\nReal-time update for Google Alphabet (GOOGL): Google Alphabet (GOOGL) trading at $322.95, -2.16% change. (2026-01-21T01:26:11.766809)\n---\nReal-time update for Apple (AAPL): Apple (AAPL) trading at $246.91, -3.28% change. (2026-01-21T01:26:11.441256)\n---\nIndustry Study: NFL Bettors Wagered Less Than Expected At Regulated Sportsbooks This Season: Optimove report found parlays remained popular, but live betting was not the boon operators anticipated (2026-01-21T01:21:25.234631)\n---\n2026-01-19 Emacs news: <ul>\n<li>Upcoming events (iCal file, Org):\n<ul>\n<li>M-x Research: TBA https://m-x-research.github.io/ Wed Jan 21 0800 America/Vancouver - 1000 America/Chicago - 1100 America/Toronto - 1600 Etc/GMT - 1700 Europe/Berlin - 2130 Asia/Kolkata – Thu Jan 22 0000 Asi… (2026-01-21T01:21:25.234056)\n---\nRockhampton residents prepare for flooding from ex-Cyclone Koji: Flooding on the Fitzroy River will be less severe than originally forecast, however about 280 properties could still be impacted. (2026-01-21T01:21:25.234824)",1768938973276,-1
"2026-01-21T00:52:40.442488","Do you know LifeForest?","No information about LifeForest is present in the provided context. The context appears to be related to stock market updates and promotions, but it does not mention LifeForest.","LifeForest: The Living Archive: LifeForest: The Living Archive\nIn a world increasingly dominated by digital clouds and cold storage, LifeForest oﬀers a radical, \nbiological alternative to memory preservation. Founded on the intersection of synthetic biology \nand forestry, LifeForest is a \"Living Data Bank\" that encodes human history, art, and personal \nlegacies into the DNA of ancient-growth tree species.\nThe Bio-Silicon Revolution\nThe company’s breakthrough lies in its DNA-Encapsulation Technology. Using CRISPR-based \nsequencing, LifeForest converts binary data—photos, videos, and text—into four-base genetic \ncode ($A, C, G, T$). This code is synthesized and integrated into the non-coding regions of a \nsapling’s genome, allowing the tree to act as a permanent, self-replicating hard drive that grows \nwith time.\nEcosystem Features:\nThe Eternal Grove: Customers can plant a \"Memory Tree\" in protected global sanctuaries. As the \ntree grows, the data remains protected within its cellular structure, shielded from electromagnetic \npulses or hardware failure.\nArbor-Retrieval Kits: Using a non-invasive leaf-sampling tool, future generations can sequence a \nsmall portion of the tree’s foliage to decode and view the stored \"ancestral\" data.\nSymbiotic Maintenance: The revenue from data storage is funneled directly into global \nreforestation eﬀorts, making LifeForest the world’s ﬁrst carbon-negative data center.\nLifeForest isn't just a storage solution; it is a bridge between the digital present and a sustainable, \nbiological future. It ensures that while technology may fade, our stories will continue to breathe.\n (2026-01-21T00:52:57.667516)\n---\nReal-time update for Microsoft (MSFT): Microsoft (MSFT) trading at $454.26, -1.24% change. (2026-01-21T01:26:12.105122)\n---\nReal-time update for Google Alphabet (GOOGL): Google Alphabet (GOOGL) trading at $322.95, -2.16% change. (2026-01-21T01:26:11.766809)\n---\nReal-time update for Apple (AAPL): Apple (AAPL) trading at $246.91, -3.28% change. (2026-01-21T01:26:11.441256)\n---\nIndustry Study: NFL Bettors Wagered Less Than Expected At Regulated Sportsbooks This Season: Optimove report found parlays remained popular, but live betting was not the boon operators anticipated (2026-01-21T01:21:25.234631)\n---\n2026-01-19 Emacs news: <ul>\n<li>Upcoming events (iCal file, Org):\n<ul>\n<li>M-x Research: TBA https://m-x-research.github.io/ Wed Jan 21 0800 America/Vancouver - 1000 America/Chicago - 1100 America/Toronto - 1600 Etc/GMT - 1700 Europe/Berlin - 2130 Asia/Kolkata – Thu Jan 22 0000 Asi… (2026-01-21T01:21:25.234056)\n---\nRockhampton residents prepare for flooding from ex-Cyclone Koji: Flooding on the Fitzroy River will be less severe than originally forecast, however about 280 properties could still be impacted. (2026-01-21T01:21:25.234824)",1768938973276,-1
