timestamp,question,answer,context_used,time,diff
"2026-01-21T00:53:25.143946","Do you know LifeForest now?","Yes, I'm familiar with LifeForest. It's a company that offers a biological alternative to traditional memory preservation methods. They use synthetic biology and forestry to encode human history, art, and personal legacies into the DNA of ancient-growth tree species, creating a \"Living Data Bank\". This is made possible by their DNA-Encapsulation Technology, which converts binary data into genetic code and integrates it into the genome of a sapling, allowing the tree to act as a permanent, self-replicating hard drive.","Now with Golden AquaCore cooling: RedMagic updates gaming smartphone with new version: RedMagic has refreshed its gaming smartphone with a new version. Available with 24 GB of RAM, 1 TB of storage and a Qualcomm Snapdragon 8 Elite Gen 5 chipset, the new release hopes to outperform RedMagic's original model with superior cooling. (2026-01-21T01:13:44.233451)\n---\n$20 Chewy eGift Card: Free w/ $49 purchase + free shipping: Stock up on essentials and get a $20 Chewy eGift Card for free with purchases of $49 or more with promo code \"WELCOME\". This deal is valid for new customers only. Shop Now at Chewy (2026-01-21T00:57:31.164421)\n---\nLifeForest: The Living Archive: LifeForest: The Living Archive\nIn a world increasingly dominated by digital clouds and cold storage, LifeForest oﬀers a radical, \nbiological alternative to memory preservation. Founded on the intersection of synthetic biology \nand forestry, LifeForest is a \"Living Data Bank\" that encodes human history, art, and personal \nlegacies into the DNA of ancient-growth tree species.\nThe Bio-Silicon Revolution\nThe company’s breakthrough lies in its DNA-Encapsulation Technology. Using CRISPR-based \nsequencing, LifeForest converts binary data—photos, videos, and text—into four-base genetic \ncode ($A, C, G, T$). This code is synthesized and integrated into the non-coding regions of a \nsapling’s genome, allowing the tree to act as a permanent, self-replicating hard drive that grows \nwith time.\nEcosystem Features:\nThe Eternal Grove: Customers can plant a \"Memory Tree\" in protected global sanctuaries. As the \ntree grows, the data remains protected within its cellular structure, shielded from electromagnetic \npulses or hardware failure.\nArbor-Retrieval Kits: Using a non-invasive leaf-sampling tool, future generations can sequence a \nsmall portion of the tree’s foliage to decode and view the stored \"ancestral\" data.\nSymbiotic Maintenance: The revenue from data storage is funneled directly into global \nreforestation eﬀorts, making LifeForest the world’s ﬁrst carbon-negative data center.\nLifeForest isn't just a storage solution; it is a bridge between the digital present and a sustainable, \nbiological future. It ensures that while technology may fade, our stories will continue to breathe.\n (2026-01-21T00:52:57.667516)\n---\n$20 Chewy eGift Card: Free w/ $49 purchase + free shipping: Stock up on essentials and get a $20 Chewy eGift Card for free with purchases of $49 or more with promo code \"WELCOME\". This deal is valid for new customers only. Shop Now at Chewy (2026-01-21T00:52:05.866596)\n---\nWhat CFOs Need to Know About the NYSE’s Tokenization Platform: The digital asset space first wanted to replace the financial system. Now, the blockchain ecosystem is lowering its gaze from that sky-high goal and seeking instead merely to eliminate legacy inefficiencies in payments and capital markets. And that goal got a… (2026-01-21T00:46:41.493399)\n---\nSegway Navimow X4 and i2 AWD robot lawn mower pre-order deals, EcoFlow DELTA 3 series power stations from $408, Aventon, more: We’ve got an exciting pre-order promotion leading today’s Monday Green Deals, with Segway Navimow now offering a 10% off coupon, 1-year of extended support, and FREE gear on its new flagship X4 series robot lawn mowers (either the X430 or X450) and i2 AWD ser… (2026-01-21T00:33:02.035703)\n---\nSegway Navimow X4 and i2 AWD robot lawn mower pre-order deals, EcoFlow DELTA 3 series power stations from $408, Aventon, more: We’ve got an exciting pre-order promotion leading today’s Monday Green Deals, with Segway Navimow now offering a 10% off coupon, 1-year of extended support, and FREE gear on its new flagship X4 series robot lawn mowers (either the X430 or X450) and i2 AWD ser… (2026-01-21T00:31:09.117162)",1768938970348,1
"2026-01-21T00:52:19.097733","Latest update on Google","The latest update for Google Alphabet (GOOGL) is that it is trading at $323.27 with a -2.06% change, as of 2026-01-21T00:51:42.492024.","Real-time update for Google Alphabet (GOOGL): Google Alphabet (GOOGL) trading at $322.76, -2.21% change. (2026-01-21T01:21:02.133855)\n---\nReal-time update for Google Alphabet (GOOGL): Google Alphabet (GOOGL) trading at $322.69, -2.23% change. (2026-01-21T01:19:40.173456)\n---\nReal-time update for Google Alphabet (GOOGL): Google Alphabet (GOOGL) trading at $322.76, -2.21% change. (2026-01-21T01:18:45.421395)\n---\nReal-time update for Google Alphabet (GOOGL): Google Alphabet (GOOGL) trading at $322.79, -2.20% change. (2026-01-21T01:13:20.921855)\n---\nReal-time update for Google Alphabet (GOOGL): Google Alphabet (GOOGL) trading at $322.70, -2.23% change. (2026-01-21T01:07:56.508664)\n---\nReal-time update for Google Alphabet (GOOGL): Google Alphabet (GOOGL) trading at $323.05, -2.12% change. (2026-01-21T01:02:32.253833)\n---\nReal-time update for Google Alphabet (GOOGL): Google Alphabet (GOOGL) trading at $323.28, -2.05% change. (2026-01-21T00:57:06.852866)",1768938970348,1
"2026-01-21T01:14:37.199587","Do you know MetaMaterial?","I'm not aware of any information about MetaMaterial in the provided context, it seems to be about various news updates including India's new mineral law, smartphone updates, flooding, and real-time stock updates for companies like Intel, AMD, Netflix, and Meta Facebook.","MetaMaterial: Engineering the Impossible: MetaMaterial: Engineering the Impossible\nMetaMaterial is a pioneering deep-tech venture dedicated to the commercialization of \"intelligent \nmatter.\" Moving beyond the limitations of the periodic table, the company designs synthetic \nstructures that exhibit physical properties not found in nature—such as negative refractive \nindices, perfect acoustic absorption, and programmable stiﬀness.\nBeyond Atomic Limits\nThe core of MetaMaterial’s innovation is the Sub-Wavelength Architecture. Rather than changing \nthe chemical composition of a substance, the company uses high-precision 3D nano-lithography \nto arrange standard polymers and metals into intricate geometric patterns. These patterns interact \nwith waves—light, sound, and radio—at a scale smaller than their wavelength, allowing for \nunprecedented control over energy.\nBreakthrough Applications:\nThe Invisibility Cloak: By bending electromagnetic waves around an object rather than reﬂecting \nthem, MetaMaterial has developed ultra-thin \"cloaking\" ﬁlms for aerospace, making vehicles \ninvisible to speciﬁc radar frequencies.\nAcoustic Insulation: Their \"Silent-Tile\" technology can block 99% of low-frequency industrial \nnoise using a panel only millimeters thick, a feat impossible for traditional foam or lead.\nSuper-Lensing: MetaMaterial optics can bypass the \"diﬀraction limit\" of standard glass, allowing \nmicroscopes to see individual DNA strands using visible light—a revolution for point-of-care \ndiagnostics.\nMetaMaterial is shifting the paradigm from \"ﬁnding\" materials to \"designing\" them. By treating \nphysics as a programmable interface, the company is building the foundations for a world where \nthe physical environment adapts perfectly to human needs.\n (2026-01-21T01:14:55.235951)\n---\nIndustry Study: NFL Bettors Wagered Less Than Expected At Regulated Sportsbooks This Season: Optimove report found parlays remained popular, but live betting was not the boon operators anticipated (2026-01-21T01:21:25.234631)\n---\n2026-01-19 Emacs news: <ul>\n<li>Upcoming events (iCal file, Org):\n<ul>\n<li>M-x Research: TBA https://m-x-research.github.io/ Wed Jan 21 0800 America/Vancouver - 1000 America/Chicago - 1100 America/Toronto - 1600 Etc/GMT - 1700 Europe/Berlin - 2130 Asia/Kolkata – Thu Jan 22 0000 Asi… (2026-01-21T01:21:25.234056)\n---\nRockhampton residents prepare for flooding from ex-Cyclone Koji: Flooding on the Fitzroy River will be less severe than originally forecast, however about 280 properties could still be impacted. (2026-01-21T01:21:25.234824)\n---\nReal-time update for Intel (INTC): Intel (INTC) trading at $48.38, 2.76% change. (2026-01-21T01:21:04.823418)\n---\nReal-time update for AMD (AMD): AMD (AMD) trading at $231.65, -0.11% change. (2026-01-21T01:21:04.471942)\n---\nReal-time update for Netflix (NFLX): Netflix (NFLX) trading at $87.85, -0.33% change. (2026-01-21T01:21:04.142013)",1768938970348,1
"2026-01-21T01:14:10.339632","Latest update on Google","The latest update for Google Alphabet (GOOGL) is trading at $322.79 with a -2.20% change as of 2026-01-21T01:13:20.921855.","Real-time update for Google Alphabet (GOOGL): Google Alphabet (GOOGL) trading at $322.76, -2.21% change. (2026-01-21T01:21:02.133855)\n---\nReal-time update for Google Alphabet (GOOGL): Google Alphabet (GOOGL) trading at $322.69, -2.23% change. (2026-01-21T01:19:40.173456)\n---\nReal-time update for Google Alphabet (GOOGL): Google Alphabet (GOOGL) trading at $322.76, -2.21% change. (2026-01-21T01:18:45.421395)\n---\nReal-time update for Google Alphabet (GOOGL): Google Alphabet (GOOGL) trading at $322.79, -2.20% change. (2026-01-21T01:13:20.921855)\n---\nReal-time update for Google Alphabet (GOOGL): Google Alphabet (GOOGL) trading at $322.70, -2.23% change. (2026-01-21T01:07:56.508664)\n---\nReal-time update for Google Alphabet (GOOGL): Google Alphabet (GOOGL) trading at $323.05, -2.12% change. (2026-01-21T01:02:32.253833)\n---\nReal-time update for Google Alphabet (GOOGL): Google Alphabet (GOOGL) trading at $323.28, -2.05% change. (2026-01-21T00:57:06.852866)",1768938970348,1
"2026-01-21T00:52:40.442488","Do you know LifeForest?","No information about LifeForest is present in the provided context. The context appears to be related to stock market updates and promotions, but it does not mention LifeForest.","LifeForest: The Living Archive: LifeForest: The Living Archive\nIn a world increasingly dominated by digital clouds and cold storage, LifeForest oﬀers a radical, \nbiological alternative to memory preservation. Founded on the intersection of synthetic biology \nand forestry, LifeForest is a \"Living Data Bank\" that encodes human history, art, and personal \nlegacies into the DNA of ancient-growth tree species.\nThe Bio-Silicon Revolution\nThe company’s breakthrough lies in its DNA-Encapsulation Technology. Using CRISPR-based \nsequencing, LifeForest converts binary data—photos, videos, and text—into four-base genetic \ncode ($A, C, G, T$). This code is synthesized and integrated into the non-coding regions of a \nsapling’s genome, allowing the tree to act as a permanent, self-replicating hard drive that grows \nwith time.\nEcosystem Features:\nThe Eternal Grove: Customers can plant a \"Memory Tree\" in protected global sanctuaries. As the \ntree grows, the data remains protected within its cellular structure, shielded from electromagnetic \npulses or hardware failure.\nArbor-Retrieval Kits: Using a non-invasive leaf-sampling tool, future generations can sequence a \nsmall portion of the tree’s foliage to decode and view the stored \"ancestral\" data.\nSymbiotic Maintenance: The revenue from data storage is funneled directly into global \nreforestation eﬀorts, making LifeForest the world’s ﬁrst carbon-negative data center.\nLifeForest isn't just a storage solution; it is a bridge between the digital present and a sustainable, \nbiological future. It ensures that while technology may fade, our stories will continue to breathe.\n (2026-01-21T00:52:57.667516)\n---\nIndustry Study: NFL Bettors Wagered Less Than Expected At Regulated Sportsbooks This Season: Optimove report found parlays remained popular, but live betting was not the boon operators anticipated (2026-01-21T01:21:25.234631)\n---\n2026-01-19 Emacs news: <ul>\n<li>Upcoming events (iCal file, Org):\n<ul>\n<li>M-x Research: TBA https://m-x-research.github.io/ Wed Jan 21 0800 America/Vancouver - 1000 America/Chicago - 1100 America/Toronto - 1600 Etc/GMT - 1700 Europe/Berlin - 2130 Asia/Kolkata – Thu Jan 22 0000 Asi… (2026-01-21T01:21:25.234056)\n---\nRockhampton residents prepare for flooding from ex-Cyclone Koji: Flooding on the Fitzroy River will be less severe than originally forecast, however about 280 properties could still be impacted. (2026-01-21T01:21:25.234824)\n---\nReal-time update for Intel (INTC): Intel (INTC) trading at $48.38, 2.76% change. (2026-01-21T01:21:04.823418)\n---\nReal-time update for AMD (AMD): AMD (AMD) trading at $231.65, -0.11% change. (2026-01-21T01:21:04.471942)\n---\nReal-time update for Netflix (NFLX): Netflix (NFLX) trading at $87.85, -0.33% change. (2026-01-21T01:21:04.142013)",1768938970348,1
"2026-01-21T00:48:50.590115","Do you know HereOne?","Yes, I'm familiar with HereOne. It's a wearable technology device that combines audio and intelligence, introducing a concept called \"Layered Listening\" which allows users to interact with their environment in a new way. HereOne features a Real-Time Audio Filtering engine, enabling selective transparency of sound, and includes integrated features like Smart Transparency, Biometric Synchronization, and a Contextual AI Assistant.","HereOne: The Convergence of Audio and Intelligence: HereOne: The Convergence of Audio and Intelligence\nIn the rapidly evolving landscape of wearable technology, HereOne stands as the deﬁnitive bridge \nbetween the physical and digital auditory worlds. While predecessors focused merely on noise \ncancellation, HereOne introduces \"Layered Listening\"—a paradigm shift in how we interact with \nour environment.\nMastering the Soundscape\nThe core innovation of HereOne lies in its Real-Time Audio Filtering engine. Unlike standard \nheadphones that isolate the user, HereOne allows for the selective transparency of sound. \nThrough an intuitive mobile interface, users can \"EQ the world,\" muting the roar of a jet engine \nwhile crystalizing the voice of a person sitting directly across from them.\nIntegrated Features:\nSmart Transparency: Adaptive microphones identify speciﬁc acoustic signatures, automatically \nlowering the volume of disruptive city sirens while maintaining awareness of ambient traﬃc.\nBiometric Synchronization: Integrated sensors track heart rate and stress levels, subtly adjusting \nthe sound proﬁle—playing calming white noise or uplifting frequencies—to match the user's \nphysiological state.\nContextual AI Assistant: A localized processor handles voice commands oﬄine, providing instant \ntranslations or meeting summaries directly into the ear canal without needing a cloud connection.\nBy blending high-ﬁdelity acoustics with sophisticated environmental control, HereOne ensures \nthat users are never just listening—they are curating their reality.\n (2026-01-21T00:40:53.396065)\n---\nIndustry Study: NFL Bettors Wagered Less Than Expected At Regulated Sportsbooks This Season: Optimove report found parlays remained popular, but live betting was not the boon operators anticipated (2026-01-21T01:21:25.234631)\n---\n2026-01-19 Emacs news: <ul>\n<li>Upcoming events (iCal file, Org):\n<ul>\n<li>M-x Research: TBA https://m-x-research.github.io/ Wed Jan 21 0800 America/Vancouver - 1000 America/Chicago - 1100 America/Toronto - 1600 Etc/GMT - 1700 Europe/Berlin - 2130 Asia/Kolkata – Thu Jan 22 0000 Asi… (2026-01-21T01:21:25.234056)\n---\nRockhampton residents prepare for flooding from ex-Cyclone Koji: Flooding on the Fitzroy River will be less severe than originally forecast, however about 280 properties could still be impacted. (2026-01-21T01:21:25.234824)\n---\nReal-time update for Intel (INTC): Intel (INTC) trading at $48.38, 2.76% change. (2026-01-21T01:21:04.823418)\n---\nReal-time update for AMD (AMD): AMD (AMD) trading at $231.65, -0.11% change. (2026-01-21T01:21:04.471942)\n---\nReal-time update for Netflix (NFLX): Netflix (NFLX) trading at $87.85, -0.33% change. (2026-01-21T01:21:04.142013)",1768938970348,1
"2026-01-21T00:48:26.781215","Recent update on Google","The most recent update for Google Alphabet (GOOGL) is a trading price of $323.49 with a -1.99% change, as of 2026-01-21T00:46:17.933135.","Real-time update for Google Alphabet (GOOGL): Google Alphabet (GOOGL) trading at $322.76, -2.21% change. (2026-01-21T01:21:02.133855)\n---\nReal-time update for Google Alphabet (GOOGL): Google Alphabet (GOOGL) trading at $322.69, -2.23% change. (2026-01-21T01:19:40.173456)\n---\nReal-time update for Google Alphabet (GOOGL): Google Alphabet (GOOGL) trading at $322.76, -2.21% change. (2026-01-21T01:18:45.421395)\n---\nReal-time update for Google Alphabet (GOOGL): Google Alphabet (GOOGL) trading at $322.79, -2.20% change. (2026-01-21T01:13:20.921855)\n---\nReal-time update for Google Alphabet (GOOGL): Google Alphabet (GOOGL) trading at $322.70, -2.23% change. (2026-01-21T01:07:56.508664)\n---\nReal-time update for Google Alphabet (GOOGL): Google Alphabet (GOOGL) trading at $323.05, -2.12% change. (2026-01-21T01:02:32.253833)\n---\nReal-time update for Google Alphabet (GOOGL): Google Alphabet (GOOGL) trading at $323.28, -2.05% change. (2026-01-21T00:57:06.852866)",1768938970348,1
"2026-01-21T00:46:39.673439","Hi","Hello, how can I assist you with your financial queries or provide information on the latest tech trends and news?","Industry Study: NFL Bettors Wagered Less Than Expected At Regulated Sportsbooks This Season: Optimove report found parlays remained popular, but live betting was not the boon operators anticipated (2026-01-21T01:21:25.234631)\n---\n2026-01-19 Emacs news: <ul>\n<li>Upcoming events (iCal file, Org):\n<ul>\n<li>M-x Research: TBA https://m-x-research.github.io/ Wed Jan 21 0800 America/Vancouver - 1000 America/Chicago - 1100 America/Toronto - 1600 Etc/GMT - 1700 Europe/Berlin - 2130 Asia/Kolkata – Thu Jan 22 0000 Asi… (2026-01-21T01:21:25.234056)\n---\n2026-01-19 Emacs news: <ul>\n<li>Upcoming events (iCal file, Org):\n<ul>\n<li>M-x Research: TBA https://m-x-research.github.io/ Wed Jan 21 0800 America/Vancouver - 1000 America/Chicago - 1100 America/Toronto - 1600 Etc/GMT - 1700 Europe/Berlin - 2130 Asia/Kolkata – Thu Jan 22 0000 Asi… (2026-01-21T01:20:03.233067)\n---\nIndustry Study: NFL Bettors Wagered Less Than Expected At Regulated Sportsbooks This Season: Optimove report found parlays remained popular, but live betting was not the boon operators anticipated (2026-01-21T01:20:03.233453)\n---\nIndustry Study: NFL Bettors Wagered Less Than Expected At Regulated Sportsbooks This Season: Optimove report found parlays remained popular, but live betting was not the boon operators anticipated (2026-01-21T01:19:09.114761)\n---\n2026-01-19 Emacs news: <ul>\n<li>Upcoming events (iCal file, Org):\n<ul>\n<li>M-x Research: TBA https://m-x-research.github.io/ Wed Jan 21 0800 America/Vancouver - 1000 America/Chicago - 1100 America/Toronto - 1600 Etc/GMT - 1700 Europe/Berlin - 2130 Asia/Kolkata – Thu Jan 22 0000 Asi… (2026-01-21T01:19:09.114289)\n---\nMetaMaterial: Engineering the Impossible: MetaMaterial: Engineering the Impossible\nMetaMaterial is a pioneering deep-tech venture dedicated to the commercialization of \"intelligent \nmatter.\" Moving beyond the limitations of the periodic table, the company designs synthetic \nstructures that exhibit physical properties not found in nature—such as negative refractive \nindices, perfect acoustic absorption, and programmable stiﬀness.\nBeyond Atomic Limits\nThe core of MetaMaterial’s innovation is the Sub-Wavelength Architecture. Rather than changing \nthe chemical composition of a substance, the company uses high-precision 3D nano-lithography \nto arrange standard polymers and metals into intricate geometric patterns. These patterns interact \nwith waves—light, sound, and radio—at a scale smaller than their wavelength, allowing for \nunprecedented control over energy.\nBreakthrough Applications:\nThe Invisibility Cloak: By bending electromagnetic waves around an object rather than reﬂecting \nthem, MetaMaterial has developed ultra-thin \"cloaking\" ﬁlms for aerospace, making vehicles \ninvisible to speciﬁc radar frequencies.\nAcoustic Insulation: Their \"Silent-Tile\" technology can block 99% of low-frequency industrial \nnoise using a panel only millimeters thick, a feat impossible for traditional foam or lead.\nSuper-Lensing: MetaMaterial optics can bypass the \"diﬀraction limit\" of standard glass, allowing \nmicroscopes to see individual DNA strands using visible light—a revolution for point-of-care \ndiagnostics.\nMetaMaterial is shifting the paradigm from \"ﬁnding\" materials to \"designing\" them. By treating \nphysics as a programmable interface, the company is building the foundations for a world where \nthe physical environment adapts perfectly to human needs.\n (2026-01-21T01:14:55.235951)",1768938970348,1
"2026-01-21T01:15:14.145118","Do you know MetaMaterial?","Yes, I'm familiar with MetaMaterial. It's a deep-tech venture that designs and commercializes synthetic structures, often referred to as \"intelligent matter,\" which exhibit physical properties not found in nature. They use high-precision 3D nano-lithography to arrange standard polymers and metals into intricate geometric patterns, allowing for unprecedented control over energy. This technology has led to breakthrough applications such as invisibility cloaks, acoustic insulation, and super-lensing, which have the potential to revolutionize various industries.","MetaMaterial: Engineering the Impossible: MetaMaterial: Engineering the Impossible\nMetaMaterial is a pioneering deep-tech venture dedicated to the commercialization of \"intelligent \nmatter.\" Moving beyond the limitations of the periodic table, the company designs synthetic \nstructures that exhibit physical properties not found in nature—such as negative refractive \nindices, perfect acoustic absorption, and programmable stiﬀness.\nBeyond Atomic Limits\nThe core of MetaMaterial’s innovation is the Sub-Wavelength Architecture. Rather than changing \nthe chemical composition of a substance, the company uses high-precision 3D nano-lithography \nto arrange standard polymers and metals into intricate geometric patterns. These patterns interact \nwith waves—light, sound, and radio—at a scale smaller than their wavelength, allowing for \nunprecedented control over energy.\nBreakthrough Applications:\nThe Invisibility Cloak: By bending electromagnetic waves around an object rather than reﬂecting \nthem, MetaMaterial has developed ultra-thin \"cloaking\" ﬁlms for aerospace, making vehicles \ninvisible to speciﬁc radar frequencies.\nAcoustic Insulation: Their \"Silent-Tile\" technology can block 99% of low-frequency industrial \nnoise using a panel only millimeters thick, a feat impossible for traditional foam or lead.\nSuper-Lensing: MetaMaterial optics can bypass the \"diﬀraction limit\" of standard glass, allowing \nmicroscopes to see individual DNA strands using visible light—a revolution for point-of-care \ndiagnostics.\nMetaMaterial is shifting the paradigm from \"ﬁnding\" materials to \"designing\" them. By treating \nphysics as a programmable interface, the company is building the foundations for a world where \nthe physical environment adapts perfectly to human needs.\n (2026-01-21T01:14:55.235951)\n---\nIndustry Study: NFL Bettors Wagered Less Than Expected At Regulated Sportsbooks This Season: Optimove report found parlays remained popular, but live betting was not the boon operators anticipated (2026-01-21T01:21:25.234631)\n---\nRockhampton residents prepare for flooding from ex-Cyclone Koji: Flooding on the Fitzroy River will be less severe than originally forecast, however about 280 properties could still be impacted. (2026-01-21T01:21:25.234824)\n---\n2026-01-19 Emacs news: <ul>\n<li>Upcoming events (iCal file, Org):\n<ul>\n<li>M-x Research: TBA https://m-x-research.github.io/ Wed Jan 21 0800 America/Vancouver - 1000 America/Chicago - 1100 America/Toronto - 1600 Etc/GMT - 1700 Europe/Berlin - 2130 Asia/Kolkata – Thu Jan 22 0000 Asi… (2026-01-21T01:21:25.234056)\n---\nReal-time update for Intel (INTC): Intel (INTC) trading at $48.38, 2.76% change. (2026-01-21T01:21:04.823418)\n---\nReal-time update for AMD (AMD): AMD (AMD) trading at $231.65, -0.11% change. (2026-01-21T01:21:04.471942)\n---\nReal-time update for Netflix (NFLX): Netflix (NFLX) trading at $87.85, -0.33% change. (2026-01-21T01:21:04.142013)",1768938970348,1
